{
  "schemaVersion": "1.0",
  "fundId": "ACPS06",
  "fundName": "統一中小基金",
  "capturedAt": "2026-10-01T13:52:10.997Z",
  "source": {
    "name": "moneydj-public",
    "navUrl": "https://www.moneydj.com/funddj/ya/yp010000.djhtm?a=ACPS06",
    "holdingsUrl": "https://www.moneydj.com/funddj/yp/yp013000.djhtm?a=ACPS06",
    "basicUrl": "https://www.moneydj.com/funddj/yp/yp011000.djhtm?a=ACPS06"
  },
  "nav": {
    "date": "2026-10-01",
    "value": 233.43,
    "changeAmount": 2.22
  },
  "fundProfile": {
    "managerNames": [
      "莊承憲"
    ]
  },
  "holdingsDisclosure": {
    "date": "2026-08-31",
    "holdings": [
      {
        "name": "奇鋐",
        "shares": 227,
        "weightPercent": 9.28,
        "monthlyChangePercent": 1.51
      },
      {
        "name": "健策",
        "shares": 96,
        "weightPercent": 6.86,
        "monthlyChangePercent": 0
      },
      {
        "name": "創意",
        "shares": 121,
        "weightPercent": 8.81,
        "monthlyChangePercent": 0
      },
      {
        "name": "南亞科",
        "shares": 955,
        "weightPercent": 6.19,
        "monthlyChangePercent": 0
      },
      {
        "name": "台光電",
        "shares": 110,
        "weightPercent": 7.2,
        "monthlyChangePercent": -1.41
      },
      {
        "name": "大立光",
        "shares": 67,
        "weightPercent": 6.12,
        "monthlyChangePercent": 0
      },
      {
        "name": "富世達",
        "shares": 256,
        "weightPercent": 7.04,
        "monthlyChangePercent": 0
      },
      {
        "name": "緯穎",
        "shares": 60,
        "weightPercent": 5.08,
        "monthlyChangePercent": -3.35
      },
      {
        "name": "欣興",
        "shares": 585,
        "weightPercent": 6.97,
        "monthlyChangePercent": -0.02
      },
      {
        "name": "南電",
        "shares": 319,
        "weightPercent": 4.68,
        "monthlyChangePercent": -0.57
      }
    ],
    "industryWeights": [
      {
        "industry": "上市電子零組件業",
        "amount": 305744,
        "weightPercent": 36.48
      },
      {
        "industry": "上市半導體業",
        "amount": 152453,
        "weightPercent": 18.19
      },
      {
        "industry": "上市電腦及週邊設備業",
        "amount": 149184,
        "weightPercent": 17.8
      },
      {
        "industry": "上櫃半導體業",
        "amount": 62020,
        "weightPercent": 7.4
      },
      {
        "industry": "上市光電業",
        "amount": 51293,
        "weightPercent": 6.12
      },
      {
        "industry": "上市通信網路業",
        "amount": 29502,
        "weightPercent": 3.52
      },
      {
        "industry": "上市電機機械",
        "amount": 23467,
        "weightPercent": 2.8
      },
      {
        "industry": "上櫃通信網路業",
        "amount": 14835,
        "weightPercent": 1.77
      },
      {
        "industry": "上櫃電子零組件業",
        "amount": 10644,
        "weightPercent": 1.27
      }
    ],
    "holdingClassWeights": [
      {
        "holdingClass": "上市半導體",
        "amount": 249674,
        "weightPercent": 29.79
      },
      {
        "holdingClass": "上市電子零組件",
        "amount": 247579,
        "weightPercent": 29.54
      },
      {
        "holdingClass": "上櫃半導體",
        "amount": 125298,
        "weightPercent": 14.95
      },
      {
        "holdingClass": "上市電腦及週邊設備",
        "amount": 89930,
        "weightPercent": 10.73
      },
      {
        "holdingClass": "上櫃通信網路",
        "amount": 52466,
        "weightPercent": 6.26
      },
      {
        "holdingClass": "存款",
        "amount": 30256,
        "weightPercent": 3.61
      },
      {
        "holdingClass": "上市通信網路",
        "amount": 20366,
        "weightPercent": 2.43
      },
      {
        "holdingClass": "上市塑膠",
        "amount": 23970,
        "weightPercent": 2.86
      }
    ]
  }
}
