{
  "schemaVersion": "1.0",
  "fundId": "ACTT06",
  "fundName": "台新主流基金",
  "capturedAt": "2026-09-24T12:10:46.351Z",
  "source": {
    "name": "moneydj-public",
    "navUrl": "https://www.moneydj.com/funddj/ya/yp010000.djhtm?a=ACTT06",
    "holdingsUrl": "https://www.moneydj.com/funddj/yp/yp013000.djhtm?a=ACTT06",
    "basicUrl": "https://www.moneydj.com/funddj/yp/yp011000.djhtm?a=ACTT06"
  },
  "nav": {
    "date": "2026-09-24",
    "value": 198.04,
    "changeAmount": 1.55
  },
  "fundProfile": {
    "managerNames": [
      "黃千雲"
    ]
  },
  "holdingsDisclosure": {
    "date": "2026-08-31",
    "holdings": [
      {
        "name": "創意",
        "shares": 44,
        "weightPercent": 7.91,
        "monthlyChangePercent": 1.66
      },
      {
        "name": "奇鋐",
        "shares": 55,
        "weightPercent": 5.55,
        "monthlyChangePercent": 0.96
      },
      {
        "name": "台光電",
        "shares": 48,
        "weightPercent": 7.76,
        "monthlyChangePercent": -1.8
      },
      {
        "name": "健策",
        "shares": 30,
        "weightPercent": 5.3,
        "monthlyChangePercent": 0
      },
      {
        "name": "欣興",
        "shares": 262,
        "weightPercent": 7.71,
        "monthlyChangePercent": 0.02
      },
      {
        "name": "聯發科",
        "shares": 43,
        "weightPercent": 4.97,
        "monthlyChangePercent": -0.74
      },
      {
        "name": "台燿",
        "shares": 164,
        "weightPercent": 6.94,
        "monthlyChangePercent": 0.14
      },
      {
        "name": "上詮",
        "shares": 202,
        "weightPercent": 4.44,
        "monthlyChangePercent": 0
      },
      {
        "name": "台積電",
        "shares": 87,
        "weightPercent": 6.17,
        "monthlyChangePercent": -3.06
      },
      {
        "name": "南亞科",
        "shares": 270,
        "weightPercent": 4.32,
        "monthlyChangePercent": 0
      }
    ],
    "industryWeights": [
      {
        "industry": "電子零組件業",
        "amount": 137075,
        "weightPercent": 40.4
      },
      {
        "industry": "半導體業",
        "amount": 128322,
        "weightPercent": 37.82
      },
      {
        "industry": "通信網路業",
        "amount": 34065,
        "weightPercent": 10.04
      },
      {
        "industry": "電腦及週邊設備業",
        "amount": 25922,
        "weightPercent": 7.64
      }
    ],
    "holdingClassWeights": [
      {
        "holdingClass": "上市電子零組件",
        "amount": 99312,
        "weightPercent": 29.27
      },
      {
        "holdingClass": "上市半導體",
        "amount": 101415,
        "weightPercent": 29.89
      },
      {
        "holdingClass": "上櫃電子零組件",
        "amount": 34167,
        "weightPercent": 10.07
      },
      {
        "holdingClass": "上櫃半導體",
        "amount": 31622,
        "weightPercent": 9.32
      },
      {
        "holdingClass": "上櫃通信網路",
        "amount": 35117,
        "weightPercent": 10.35
      },
      {
        "holdingClass": "上市電腦及週邊設備",
        "amount": 22563,
        "weightPercent": 6.65
      },
      {
        "holdingClass": "存款",
        "amount": 14081,
        "weightPercent": 4.15
      },
      {
        "holdingClass": "上市通信網路",
        "amount": 4343,
        "weightPercent": 1.28
      }
    ]
  }
}
