{
  "schemaVersion": "1.0",
  "fundId": "ACDD01",
  "fundName": "安聯台灣大壩基金-A累積型",
  "capturedAt": "2026-09-02T11:41:54.851Z",
  "source": {
    "name": "moneydj-public",
    "navUrl": "https://www.moneydj.com/funddj/ya/yp010000.djhtm?a=ACDD01",
    "holdingsUrl": "https://www.moneydj.com/funddj/yp/yp013000.djhtm?a=ACDD01",
    "basicUrl": "https://www.moneydj.com/funddj/yp/yp011000.djhtm?a=ACDD01"
  },
  "nav": {
    "date": "2026-09-02",
    "value": 327.68,
    "changeAmount": -4.86
  },
  "fundProfile": {
    "managerNames": [
      "蕭惠中"
    ]
  },
  "holdingsDisclosure": {
    "date": "2026-07-31",
    "holdings": [
      {
        "name": "旺矽",
        "shares": 1858,
        "weightPercent": 12.74,
        "monthlyChangePercent": 0.57
      },
      {
        "name": "信驊",
        "shares": 294,
        "weightPercent": 5.55,
        "monthlyChangePercent": 0.8
      },
      {
        "name": "台光電",
        "shares": 1147,
        "weightPercent": 7.07,
        "monthlyChangePercent": 0.42
      },
      {
        "name": "欣興",
        "shares": 4589,
        "weightPercent": 4.69,
        "monthlyChangePercent": -0.37
      },
      {
        "name": "台積電",
        "shares": 2004,
        "weightPercent": 6.31,
        "monthlyChangePercent": 1.11
      },
      {
        "name": "南電",
        "shares": 3106,
        "weightPercent": 3.71,
        "monthlyChangePercent": 0.31
      },
      {
        "name": "穎崴",
        "shares": 818,
        "weightPercent": 6.18,
        "monthlyChangePercent": -0.93
      },
      {
        "name": "台達電",
        "shares": 1648,
        "weightPercent": 3.51,
        "monthlyChangePercent": 0.32
      },
      {
        "name": "台燿",
        "shares": 3982,
        "weightPercent": 5.74,
        "monthlyChangePercent": -1.45
      },
      {
        "name": "智邦",
        "shares": 1185,
        "weightPercent": 3.27,
        "monthlyChangePercent": 0.09
      }
    ],
    "industryWeights": [
      {
        "industry": "半導體業",
        "amount": 3786648,
        "weightPercent": 49.17
      },
      {
        "industry": "電子零組件業",
        "amount": 2251042,
        "weightPercent": 29.23
      },
      {
        "industry": "電腦及週邊設備",
        "amount": 492103,
        "weightPercent": 6.39
      },
      {
        "industry": "流動資金",
        "amount": 422792,
        "weightPercent": 5.49
      },
      {
        "industry": "通信網路",
        "amount": 410471,
        "weightPercent": 5.33
      },
      {
        "industry": "光電業",
        "amount": 136310,
        "weightPercent": 1.77
      },
      {
        "industry": "其他電子業",
        "amount": 120908,
        "weightPercent": 1.57
      },
      {
        "industry": "運動休閒",
        "amount": 33885,
        "weightPercent": 0.44
      },
      {
        "industry": "化學工業",
        "amount": 30805,
        "weightPercent": 0.4
      },
      {
        "industry": "電機機械",
        "amount": 16172,
        "weightPercent": 0.21
      }
    ],
    "holdingClassWeights": [
      {
        "holdingClass": "上市電子零組件",
        "amount": 1746617,
        "weightPercent": 22.68
      },
      {
        "holdingClass": "上市半導體",
        "amount": 1605687,
        "weightPercent": 20.85
      },
      {
        "holdingClass": "上櫃半導體",
        "amount": 1424710,
        "weightPercent": 18.5
      },
      {
        "holdingClass": "上市電腦及週邊設備",
        "amount": 847125,
        "weightPercent": 11
      },
      {
        "holdingClass": "上櫃電子零組件",
        "amount": 492873,
        "weightPercent": 6.4
      },
      {
        "holdingClass": "上市光電",
        "amount": 469769,
        "weightPercent": 6.1
      },
      {
        "holdingClass": "上櫃通信網路",
        "amount": 343471,
        "weightPercent": 4.46
      },
      {
        "holdingClass": "上市通信網路",
        "amount": 129379,
        "weightPercent": 1.68
      },
      {
        "holdingClass": "附條件債券",
        "amount": 241046,
        "weightPercent": 3.13
      },
      {
        "holdingClass": "上市其他電子",
        "amount": 120908,
        "weightPercent": 1.57
      },
      {
        "holdingClass": "存款",
        "amount": 90873,
        "weightPercent": 1.18
      },
      {
        "holdingClass": "上市電機機械",
        "amount": 86253,
        "weightPercent": 1.12
      },
      {
        "holdingClass": "上市運動休閒",
        "amount": 26184,
        "weightPercent": 0.34
      },
      {
        "holdingClass": "上櫃電腦及週邊設備",
        "amount": 42356,
        "weightPercent": 0.55
      }
    ]
  }
}
