{
  "schemaVersion": "1.0",
  "fundId": "ACNB01",
  "fundName": "路博邁台灣5G股票基金T累積型",
  "capturedAt": "2026-08-25T12:35:15.440Z",
  "source": {
    "name": "moneydj-public",
    "navUrl": "https://www.moneydj.com/funddj/ya/yp010000.djhtm?a=ACNB01",
    "holdingsUrl": "https://www.moneydj.com/funddj/yp/yp013000.djhtm?a=ACNB01",
    "basicUrl": "https://www.moneydj.com/funddj/yp/yp011000.djhtm?a=ACNB01"
  },
  "nav": {
    "date": "2026-08-25",
    "value": 89.79,
    "changeAmount": 1.32
  },
  "fundProfile": {
    "managerNames": [
      "黃煜"
    ]
  },
  "holdingsDisclosure": {
    "date": "2026-07-31",
    "holdings": [
      {
        "name": "台積電",
        "shares": 1032,
        "weightPercent": 9.81,
        "monthlyChangePercent": 7.95
      },
      {
        "name": "台達電",
        "shares": 704,
        "weightPercent": 4.53,
        "monthlyChangePercent": 0
      },
      {
        "name": "聯發科",
        "shares": 511,
        "weightPercent": 7.12,
        "monthlyChangePercent": 0.69
      },
      {
        "name": "創意",
        "shares": 289,
        "weightPercent": 4.31,
        "monthlyChangePercent": -1.67
      },
      {
        "name": "貿聯-KY",
        "shares": 686,
        "weightPercent": 5.65,
        "monthlyChangePercent": 0
      },
      {
        "name": "聯電",
        "shares": 9021,
        "weightPercent": 4.28,
        "monthlyChangePercent": 1.92
      },
      {
        "name": "致茂",
        "shares": 618,
        "weightPercent": 5.09,
        "monthlyChangePercent": 0
      },
      {
        "name": "健策",
        "shares": 301,
        "weightPercent": 4.07,
        "monthlyChangePercent": 0
      },
      {
        "name": "緯穎",
        "shares": 241,
        "weightPercent": 5.09,
        "monthlyChangePercent": 0
      },
      {
        "name": "力旺",
        "shares": 412,
        "weightPercent": 4,
        "monthlyChangePercent": 0.43
      }
    ],
    "industryWeights": [
      {
        "industry": "半導體",
        "amount": 1280524,
        "weightPercent": 50.21
      },
      {
        "industry": "電子零組件",
        "amount": 569490,
        "weightPercent": 22.33
      },
      {
        "industry": "其他電子業",
        "amount": 312671,
        "weightPercent": 12.26
      },
      {
        "industry": "電腦及週邊設備",
        "amount": 283087,
        "weightPercent": 11.1
      },
      {
        "industry": "電機機械",
        "amount": 74470,
        "weightPercent": 2.92
      },
      {
        "industry": "通信網路業",
        "amount": 15047,
        "weightPercent": 0.59
      },
      {
        "industry": "光電業",
        "amount": 14792,
        "weightPercent": 0.58
      }
    ],
    "holdingClassWeights": [
      {
        "holdingClass": "上市半導體",
        "amount": 827839,
        "weightPercent": 32.46
      },
      {
        "holdingClass": "上市電子零組件",
        "amount": 763571,
        "weightPercent": 29.94
      },
      {
        "holdingClass": "上櫃半導體",
        "amount": 406014,
        "weightPercent": 15.92
      },
      {
        "holdingClass": "上市電腦及週邊設備",
        "amount": 154805,
        "weightPercent": 6.07
      },
      {
        "holdingClass": "上市其他電子",
        "amount": 190255,
        "weightPercent": 7.46
      },
      {
        "holdingClass": "存款",
        "amount": 78805,
        "weightPercent": 3.09
      },
      {
        "holdingClass": "上市電機機械",
        "amount": 97933,
        "weightPercent": 3.84
      },
      {
        "holdingClass": "上櫃通信網路",
        "amount": 42081,
        "weightPercent": 1.65
      },
      {
        "holdingClass": "上市通信網路",
        "amount": 11987,
        "weightPercent": 0.47
      }
    ]
  }
}
