{
  "schemaVersion": "1.0",
  "fundId": "ACFH15",
  "fundName": "復華全方位基金A類型",
  "capturedAt": "2026-08-24T10:35:20.499Z",
  "source": {
    "name": "moneydj-public",
    "navUrl": "https://www.moneydj.com/funddj/ya/yp010000.djhtm?a=ACFH15",
    "holdingsUrl": "https://www.moneydj.com/funddj/yp/yp013000.djhtm?a=ACFH15",
    "basicUrl": "https://www.moneydj.com/funddj/yp/yp011000.djhtm?a=ACFH15"
  },
  "nav": {
    "date": "2026-08-24",
    "value": 188.68,
    "changeAmount": -2.85
  },
  "fundProfile": {
    "managerNames": [
      "戎宜蘋"
    ]
  },
  "holdingsDisclosure": {
    "date": "2026-07-31",
    "holdings": [
      {
        "name": "台光電",
        "shares": 179,
        "weightPercent": 7.75,
        "monthlyChangePercent": 1.52
      },
      {
        "name": "奇鋐",
        "shares": 240,
        "weightPercent": 5.07,
        "monthlyChangePercent": 2.08
      },
      {
        "name": "欣興",
        "shares": 898,
        "weightPercent": 6.44,
        "monthlyChangePercent": -0.61
      },
      {
        "name": "台達電",
        "shares": 309,
        "weightPercent": 4.61,
        "monthlyChangePercent": 1.2
      },
      {
        "name": "南電",
        "shares": 699,
        "weightPercent": 5.86,
        "monthlyChangePercent": 0.98
      },
      {
        "name": "旺矽",
        "shares": 96,
        "weightPercent": 4.6,
        "monthlyChangePercent": 3.26
      },
      {
        "name": "台積電",
        "shares": 260,
        "weightPercent": 5.74,
        "monthlyChangePercent": -0.16
      },
      {
        "name": "聯電",
        "shares": 3557,
        "weightPercent": 3.92,
        "monthlyChangePercent": -0.37
      },
      {
        "name": "智邦",
        "shares": 294,
        "weightPercent": 5.69,
        "monthlyChangePercent": 1.81
      },
      {
        "name": "聯發科",
        "shares": 117,
        "weightPercent": 3.78,
        "monthlyChangePercent": -2.89
      }
    ],
    "industryWeights": [
      {
        "industry": "電子零組件",
        "amount": 428962,
        "weightPercent": 39.07
      },
      {
        "industry": "半導體",
        "amount": 346507,
        "weightPercent": 31.56
      },
      {
        "industry": "電腦及週邊設備",
        "amount": 100351,
        "weightPercent": 9.14
      },
      {
        "industry": "通信網路",
        "amount": 92336,
        "weightPercent": 8.41
      },
      {
        "industry": "其他電子",
        "amount": 48089,
        "weightPercent": 4.38
      },
      {
        "industry": "流動資產",
        "amount": 47431,
        "weightPercent": 4.32
      },
      {
        "industry": "塑膠工業",
        "amount": 21410,
        "weightPercent": 1.95
      },
      {
        "industry": "光電",
        "amount": 12846,
        "weightPercent": 1.17
      }
    ],
    "holdingClassWeights": [
      {
        "holdingClass": "上市電子零組件",
        "amount": 450920,
        "weightPercent": 41.07
      },
      {
        "holdingClass": "上市半導體",
        "amount": 238031,
        "weightPercent": 21.68
      },
      {
        "holdingClass": "上市電腦及週邊設備",
        "amount": 116930,
        "weightPercent": 10.65
      },
      {
        "holdingClass": "上市通信網路",
        "amount": 62582,
        "weightPercent": 5.7
      },
      {
        "holdingClass": "上櫃半導體",
        "amount": 56873,
        "weightPercent": 5.18
      },
      {
        "holdingClass": "上市其他電子",
        "amount": 42929,
        "weightPercent": 3.91
      },
      {
        "holdingClass": "上櫃電子零組件",
        "amount": 38977,
        "weightPercent": 3.55
      },
      {
        "holdingClass": "存款",
        "amount": 17018,
        "weightPercent": 1.55
      },
      {
        "holdingClass": "上市塑膠",
        "amount": 21190,
        "weightPercent": 1.93
      },
      {
        "holdingClass": "上櫃通信網路",
        "amount": 28876,
        "weightPercent": 2.63
      },
      {
        "holdingClass": "上市光電",
        "amount": 11199,
        "weightPercent": 1.02
      }
    ]
  }
}
