{
  "schemaVersion": "1.0",
  "fundId": "ACPS03",
  "fundName": "統一龍馬基金",
  "capturedAt": "2026-08-18T09:35:20.791Z",
  "source": {
    "name": "moneydj-public",
    "navUrl": "https://www.moneydj.com/funddj/ya/yp010000.djhtm?a=ACPS03",
    "holdingsUrl": "https://www.moneydj.com/funddj/yp/yp013000.djhtm?a=ACPS03",
    "basicUrl": "https://www.moneydj.com/funddj/yp/yp011000.djhtm?a=ACPS03"
  },
  "nav": {
    "date": "2026-08-18",
    "value": 649.49,
    "changeAmount": -18.46
  },
  "fundProfile": {
    "managerNames": [
      "莊承憲"
    ]
  },
  "holdingsDisclosure": {
    "date": "2026-07-31",
    "holdings": [
      {
        "name": "台光電",
        "shares": 174,
        "weightPercent": 8.9,
        "monthlyChangePercent": 1.6
      },
      {
        "name": "智邦",
        "shares": 311,
        "weightPercent": 7.12,
        "monthlyChangePercent": 3.09
      },
      {
        "name": "緯穎",
        "shares": 143,
        "weightPercent": 8.3,
        "monthlyChangePercent": 5.51
      },
      {
        "name": "貿聯-KY",
        "shares": 283,
        "weightPercent": 6.4,
        "monthlyChangePercent": 4.73
      },
      {
        "name": "奇鋐",
        "shares": 302,
        "weightPercent": 7.55,
        "monthlyChangePercent": 3.22
      },
      {
        "name": "旺矽",
        "shares": 110,
        "weightPercent": 6.26,
        "monthlyChangePercent": 0.21
      },
      {
        "name": "欣興",
        "shares": 872,
        "weightPercent": 7.39,
        "monthlyChangePercent": -0.74
      },
      {
        "name": "南電",
        "shares": 524,
        "weightPercent": 5.19,
        "monthlyChangePercent": 0.93
      },
      {
        "name": "致茂",
        "shares": 323,
        "weightPercent": 7.31,
        "monthlyChangePercent": 0
      },
      {
        "name": "台燿",
        "shares": 405,
        "weightPercent": 4.84,
        "monthlyChangePercent": 0.68
      }
    ],
    "industryWeights": [
      {
        "industry": "上市電子零組件業",
        "amount": 367048,
        "weightPercent": 36.82
      },
      {
        "industry": "上市半導體業",
        "amount": 244333,
        "weightPercent": 24.51
      },
      {
        "industry": "上櫃半導體業",
        "amount": 134777,
        "weightPercent": 13.52
      },
      {
        "industry": "上市電腦及週邊設備業",
        "amount": 70977,
        "weightPercent": 7.12
      },
      {
        "industry": "上櫃電子零組件業",
        "amount": 46255,
        "weightPercent": 4.64
      },
      {
        "industry": "上市通信網路業",
        "amount": 40174,
        "weightPercent": 4.03
      },
      {
        "industry": "上市其他電子業",
        "amount": 39376,
        "weightPercent": 3.95
      },
      {
        "industry": "上櫃光電業",
        "amount": 18542,
        "weightPercent": 1.86
      },
      {
        "industry": "上市光電業",
        "amount": 10168,
        "weightPercent": 1.02
      }
    ],
    "holdingClassWeights": [
      {
        "holdingClass": "上市電子零組件",
        "amount": 302193,
        "weightPercent": 32.56
      },
      {
        "holdingClass": "上市電腦及週邊設備",
        "amount": 134576,
        "weightPercent": 14.5
      },
      {
        "holdingClass": "上市半導體",
        "amount": 153417,
        "weightPercent": 16.53
      },
      {
        "holdingClass": "上市其他電子",
        "amount": 68866,
        "weightPercent": 7.42
      },
      {
        "holdingClass": "上櫃半導體",
        "amount": 100515,
        "weightPercent": 10.83
      },
      {
        "holdingClass": "上市通信網路",
        "amount": 60049,
        "weightPercent": 6.47
      },
      {
        "holdingClass": "上櫃電子零組件",
        "amount": 53274,
        "weightPercent": 5.74
      },
      {
        "holdingClass": "存款",
        "amount": 49840,
        "weightPercent": 5.37
      },
      {
        "holdingClass": "上櫃通信網路",
        "amount": 30535,
        "weightPercent": 3.29
      }
    ]
  }
}
