{
  "schemaVersion": "1.0",
  "fundId": "ACFH67",
  "fundName": "復華全球物聯網科技基金(台幣)",
  "capturedAt": "2026-08-21T12:35:23.228Z",
  "source": {
    "name": "moneydj-public",
    "navUrl": "https://www.moneydj.com/funddj/ya/yp010000.djhtm?a=ACFH67",
    "holdingsUrl": "https://www.moneydj.com/funddj/yp/yp013000.djhtm?a=ACFH67",
    "basicUrl": "https://www.moneydj.com/funddj/yp/yp011000.djhtm?a=ACFH67"
  },
  "nav": {
    "date": "2026-08-20",
    "value": 82.52,
    "changeAmount": 0.55
  },
  "fundProfile": {
    "managerNames": [
      "黃俊瑞",
      "蔡盛宇"
    ]
  },
  "holdingsDisclosure": {
    "date": "2026-07-31",
    "holdings": [
      {
        "name": "MURATA MANUFACTURING CO LTD-JPN",
        "shares": 0,
        "weightPercent": 4.31,
        "monthlyChangePercent": 0.21
      },
      {
        "name": "SANDISK CORP-USA",
        "shares": 0,
        "weightPercent": 3.44,
        "monthlyChangePercent": -2.45
      },
      {
        "name": "台光電",
        "shares": 244,
        "weightPercent": 3.99,
        "monthlyChangePercent": 1.07
      },
      {
        "name": "ADVANTEST CORP-JPN",
        "shares": 0,
        "weightPercent": 3.33,
        "monthlyChangePercent": 1.79
      },
      {
        "name": "MICRON TECHNOLOGY INC-USA",
        "shares": 0,
        "weightPercent": 3.83,
        "monthlyChangePercent": 1
      },
      {
        "name": "欣興",
        "shares": 1217,
        "weightPercent": 3.3,
        "monthlyChangePercent": 0.48
      },
      {
        "name": "MARVELL TECHNOLOGY INC-USA",
        "shares": 0,
        "weightPercent": 3.75,
        "monthlyChangePercent": -0.32
      },
      {
        "name": "旺矽",
        "shares": 178,
        "weightPercent": 3.24,
        "monthlyChangePercent": 0.65
      },
      {
        "name": "SK HYNIX INC-KOR",
        "shares": 0,
        "weightPercent": 3.6,
        "monthlyChangePercent": -1.25
      },
      {
        "name": "NVIDIA CORP-USA",
        "shares": 0,
        "weightPercent": 3.08,
        "monthlyChangePercent": 0.98
      }
    ],
    "industryWeights": [
      {
        "industry": "資訊技術",
        "amount": 2744483,
        "weightPercent": 94.54
      },
      {
        "industry": "工業",
        "amount": 71123,
        "weightPercent": 2.45
      },
      {
        "industry": "原材料",
        "amount": 44416,
        "weightPercent": 1.53
      },
      {
        "industry": "流動資產",
        "amount": 42964,
        "weightPercent": 1.48
      }
    ],
    "holdingClassWeights": [
      {
        "holdingClass": "北美",
        "amount": 1294151,
        "weightPercent": 44.58
      },
      {
        "holdingClass": "日本",
        "amount": 575662,
        "weightPercent": 19.83
      },
      {
        "holdingClass": "上市電子零組件",
        "amount": 504829,
        "weightPercent": 17.39
      },
      {
        "holdingClass": "存款",
        "amount": 99863,
        "weightPercent": 3.44
      },
      {
        "holdingClass": "上市半導體",
        "amount": 105959,
        "weightPercent": 3.65
      },
      {
        "holdingClass": "上櫃半導體",
        "amount": 98992,
        "weightPercent": 3.41
      },
      {
        "holdingClass": "上市電腦及週邊設備",
        "amount": 87380,
        "weightPercent": 3.01
      },
      {
        "holdingClass": "已開發歐洲",
        "amount": 61834,
        "weightPercent": 2.13
      },
      {
        "holdingClass": "上市其他電子",
        "amount": 66478,
        "weightPercent": 2.29
      },
      {
        "holdingClass": "國外存託憑證",
        "amount": 26127,
        "weightPercent": 0.9
      }
    ]
  }
}
