{
  "schemaVersion": "1.0",
  "fundId": "ACDD04",
  "fundName": "安聯台灣科技基金",
  "capturedAt": "2026-08-24T09:35:12.132Z",
  "source": {
    "name": "moneydj-public",
    "navUrl": "https://www.moneydj.com/funddj/ya/yp010000.djhtm?a=ACDD04",
    "holdingsUrl": "https://www.moneydj.com/funddj/yp/yp013000.djhtm?a=ACDD04",
    "basicUrl": "https://www.moneydj.com/funddj/yp/yp011000.djhtm?a=ACDD04"
  },
  "nav": {
    "date": "2026-08-21",
    "value": 744.27,
    "changeAmount": -15.39
  },
  "fundProfile": {
    "managerNames": [
      "蕭惠中",
      "李侃奇"
    ]
  },
  "holdingsDisclosure": {
    "date": "2026-07-31",
    "holdings": [
      {
        "name": "台積電",
        "shares": 8561,
        "weightPercent": 8.22,
        "monthlyChangePercent": 1.85
      },
      {
        "name": "創意",
        "shares": 2801,
        "weightPercent": 4.22,
        "monthlyChangePercent": -0.26
      },
      {
        "name": "旺矽",
        "shares": 3640,
        "weightPercent": 7.61,
        "monthlyChangePercent": 0.29
      },
      {
        "name": "聯電",
        "shares": 87043,
        "weightPercent": 4.17,
        "monthlyChangePercent": -0.07
      },
      {
        "name": "台光電",
        "shares": 3002,
        "weightPercent": 5.64,
        "monthlyChangePercent": 0.3
      },
      {
        "name": "奇鋐",
        "shares": 4235,
        "weightPercent": 3.89,
        "monthlyChangePercent": 0.8
      },
      {
        "name": "欣興",
        "shares": 14506,
        "weightPercent": 4.52,
        "monthlyChangePercent": 1.71
      },
      {
        "name": "穎崴",
        "shares": 1681,
        "weightPercent": 3.87,
        "monthlyChangePercent": -0.62
      },
      {
        "name": "台燿",
        "shares": 9693,
        "weightPercent": 4.26,
        "monthlyChangePercent": -1.12
      },
      {
        "name": "國巨*",
        "shares": 17006,
        "weightPercent": 3.38,
        "monthlyChangePercent": -2.27
      }
    ],
    "industryWeights": [
      {
        "industry": "半導體業",
        "amount": 12290137,
        "weightPercent": 48.66
      },
      {
        "industry": "電子零組件業",
        "amount": 7493801,
        "weightPercent": 29.67
      },
      {
        "industry": "電腦及週邊設備",
        "amount": 1818516,
        "weightPercent": 7.2
      },
      {
        "industry": "其他電子業",
        "amount": 1429556,
        "weightPercent": 5.66
      },
      {
        "industry": "流動資金",
        "amount": 1396721,
        "weightPercent": 5.53
      },
      {
        "industry": "通信網路業",
        "amount": 477360,
        "weightPercent": 1.89
      },
      {
        "industry": "化學工業",
        "amount": 250046,
        "weightPercent": 0.99
      },
      {
        "industry": "鋼鐵工業",
        "amount": 42937,
        "weightPercent": 0.17
      },
      {
        "industry": "其他產業",
        "amount": 30309,
        "weightPercent": 0.12
      },
      {
        "industry": "電機機械",
        "amount": 27783,
        "weightPercent": 0.11
      }
    ],
    "holdingClassWeights": [
      {
        "holdingClass": "上市半導體",
        "amount": 7655447,
        "weightPercent": 30.31
      },
      {
        "holdingClass": "上市電子零組件",
        "amount": 7337207,
        "weightPercent": 29.05
      },
      {
        "holdingClass": "上櫃半導體",
        "amount": 3685021,
        "weightPercent": 14.59
      },
      {
        "holdingClass": "上市電腦及週邊設備",
        "amount": 1959956,
        "weightPercent": 7.76
      },
      {
        "holdingClass": "上櫃電子零組件",
        "amount": 1295693,
        "weightPercent": 5.13
      },
      {
        "holdingClass": "上市其他電子",
        "amount": 1086058,
        "weightPercent": 4.3
      },
      {
        "holdingClass": "附條件債券",
        "amount": 537978,
        "weightPercent": 2.13
      },
      {
        "holdingClass": "上市通信網路",
        "amount": 310663,
        "weightPercent": 1.23
      },
      {
        "holdingClass": "存款",
        "amount": 285406,
        "weightPercent": 1.13
      },
      {
        "holdingClass": "上市化工",
        "amount": 214686,
        "weightPercent": 0.85
      },
      {
        "holdingClass": "上櫃其他電子",
        "amount": 191954,
        "weightPercent": 0.76
      },
      {
        "holdingClass": "上櫃通信網路",
        "amount": 143966,
        "weightPercent": 0.57
      },
      {
        "holdingClass": "上櫃電腦及週邊設備",
        "amount": 212160,
        "weightPercent": 0.84
      },
      {
        "holdingClass": "上市鋼鐵",
        "amount": 20206,
        "weightPercent": 0.08
      },
      {
        "holdingClass": "上市電機機械",
        "amount": 98503,
        "weightPercent": 0.39
      },
      {
        "holdingClass": "上市運動休閒",
        "amount": 15154,
        "weightPercent": 0.06
      },
      {
        "holdingClass": "上櫃生技醫療",
        "amount": 7577,
        "weightPercent": 0.03
      }
    ]
  }
}
