{
  "schemaVersion": "1.0",
  "fundId": "ACPS26",
  "fundName": "統一新亞洲科技能源基金",
  "capturedAt": "2026-09-25T12:35:16.846Z",
  "source": {
    "name": "moneydj-public",
    "navUrl": "https://www.moneydj.com/funddj/ya/yp010000.djhtm?a=ACPS26",
    "holdingsUrl": "https://www.moneydj.com/funddj/yp/yp013000.djhtm?a=ACPS26",
    "basicUrl": "https://www.moneydj.com/funddj/yp/yp011000.djhtm?a=ACPS26"
  },
  "nav": {
    "date": "2026-09-23",
    "value": 138.34,
    "changeAmount": -0.83
  },
  "fundProfile": {
    "managerNames": [
      "郭智偉"
    ]
  },
  "holdingsDisclosure": {
    "date": "2026-08-31",
    "holdings": [
      {
        "name": "台光電",
        "shares": 75,
        "weightPercent": 7.13,
        "monthlyChangePercent": 2.98
      },
      {
        "name": "KIOXIA HOLDINGS CORP",
        "shares": 0,
        "weightPercent": 3.87,
        "monthlyChangePercent": -1.8
      },
      {
        "name": "台積電",
        "shares": 152,
        "weightPercent": 6.34,
        "monthlyChangePercent": -1.6
      },
      {
        "name": "KEYENCE CORP",
        "shares": 0,
        "weightPercent": 3.71,
        "monthlyChangePercent": 0
      },
      {
        "name": "台燿",
        "shares": 193,
        "weightPercent": 4.8,
        "monthlyChangePercent": 0.81
      },
      {
        "name": "聯亞",
        "shares": 57,
        "weightPercent": 3.5,
        "monthlyChangePercent": 0
      },
      {
        "name": "ADVANCED MICRO DEVICES.amd us",
        "shares": 0,
        "weightPercent": 4.52,
        "monthlyChangePercent": -0.48
      },
      {
        "name": "華星光",
        "shares": 262,
        "weightPercent": 2.77,
        "monthlyChangePercent": 0
      },
      {
        "name": "聯發科",
        "shares": 63,
        "weightPercent": 4.29,
        "monthlyChangePercent": 0.12
      },
      {
        "name": "CROWDSTRIKE HOLDINGS INC - A",
        "shares": 0,
        "weightPercent": 2.7,
        "monthlyChangePercent": 0
      }
    ],
    "industryWeights": [],
    "holdingClassWeights": [
      {
        "holdingClass": "存款",
        "amount": 36797,
        "weightPercent": 6.38
      }
    ]
  }
}
