{
  "schemaVersion": "1.0",
  "fundId": "ACPS26",
  "fundName": "統一新亞洲科技能源基金",
  "capturedAt": "2026-08-06T10:35:10.121Z",
  "source": {
    "name": "moneydj-public",
    "navUrl": "https://www.moneydj.com/funddj/ya/yp010000.djhtm?a=ACPS26",
    "holdingsUrl": "https://www.moneydj.com/funddj/yp/yp013000.djhtm?a=ACPS26",
    "basicUrl": "https://www.moneydj.com/funddj/yp/yp011000.djhtm?a=ACPS26"
  },
  "nav": {
    "date": "2026-08-05",
    "value": 134.98,
    "changeAmount": 2.26
  },
  "fundProfile": {
    "managerNames": [
      "郭智偉"
    ]
  },
  "holdingsDisclosure": {
    "date": "2026-06-30",
    "holdings": [
      {
        "name": "KIOXIA HOLDINGS CORP",
        "shares": 0,
        "weightPercent": 8.51,
        "monthlyChangePercent": -1.55
      },
      {
        "name": "聯發科",
        "shares": 49,
        "weightPercent": 3.1,
        "monthlyChangePercent": 0
      },
      {
        "name": "TAIYO YUDEN CO LTD",
        "shares": 0,
        "weightPercent": 8.26,
        "monthlyChangePercent": 2.5
      },
      {
        "name": "SK HYNIX INC",
        "shares": 0,
        "weightPercent": 3.08,
        "monthlyChangePercent": 0
      },
      {
        "name": "Micron Technology Inc",
        "shares": 0,
        "weightPercent": 7.18,
        "monthlyChangePercent": 0.2
      },
      {
        "name": "ADVANCED MICRO DEVICES.amd us",
        "shares": 0,
        "weightPercent": 2.81,
        "monthlyChangePercent": 0
      },
      {
        "name": "MURATA MANUFACTURING CO LTD",
        "shares": 0,
        "weightPercent": 6.25,
        "monthlyChangePercent": 0
      },
      {
        "name": "COHERENT INC",
        "shares": 0,
        "weightPercent": 2.64,
        "monthlyChangePercent": 0
      },
      {
        "name": "聯電",
        "shares": 2070,
        "weightPercent": 5.07,
        "monthlyChangePercent": 0
      },
      {
        "name": "ZHONGJI INNOLIGHT CO LTD-A",
        "shares": 0,
        "weightPercent": 2.4,
        "monthlyChangePercent": -2.44
      },
      {
        "name": "台燿",
        "shares": 193,
        "weightPercent": 4.83,
        "monthlyChangePercent": -1.24
      },
      {
        "name": "高力",
        "shares": 98,
        "weightPercent": 2.26,
        "monthlyChangePercent": 0
      },
      {
        "name": "台積電",
        "shares": 133,
        "weightPercent": 4.77,
        "monthlyChangePercent": -1.06
      },
      {
        "name": "智邦",
        "shares": 46,
        "weightPercent": 1.71,
        "monthlyChangePercent": 0
      },
      {
        "name": "BLOOM ENERGY CORP- A",
        "shares": 0,
        "weightPercent": 4.37,
        "monthlyChangePercent": -0.69
      },
      {
        "name": "聯亞",
        "shares": 52,
        "weightPercent": 1.56,
        "monthlyChangePercent": 0
      },
      {
        "name": "SANDISK CORP",
        "shares": 0,
        "weightPercent": 4.07,
        "monthlyChangePercent": 0.33
      },
      {
        "name": "欣興",
        "shares": 82,
        "weightPercent": 1.31,
        "monthlyChangePercent": 0
      },
      {
        "name": "台光電",
        "shares": 47,
        "weightPercent": 3.77,
        "monthlyChangePercent": -0.71
      },
      {
        "name": "旺矽",
        "shares": 14,
        "weightPercent": 1.27,
        "monthlyChangePercent": 0
      },
      {
        "name": "EOPTOLINK TECHNOLOGY INC L-A",
        "shares": 0,
        "weightPercent": 3.45,
        "monthlyChangePercent": -0.09
      }
    ],
    "industryWeights": [],
    "holdingClassWeights": [
      {
        "holdingClass": "北美",
        "amount": 129152,
        "weightPercent": 19.23
      },
      {
        "holdingClass": "日本",
        "amount": 134793,
        "weightPercent": 20.07
      },
      {
        "holdingClass": "上市半導體",
        "amount": 119951,
        "weightPercent": 17.86
      },
      {
        "holdingClass": "存款",
        "amount": 102892,
        "weightPercent": 15.32
      },
      {
        "holdingClass": "大陸地區",
        "amount": 38685,
        "weightPercent": 5.76
      },
      {
        "holdingClass": "上市電子零組件",
        "amount": 41304,
        "weightPercent": 6.15
      },
      {
        "holdingClass": "上櫃電子零組件",
        "amount": 26797,
        "weightPercent": 3.99
      },
      {
        "holdingClass": "亞洲不含日本",
        "amount": 18537,
        "weightPercent": 2.76
      },
      {
        "holdingClass": "上櫃半導體",
        "amount": 13231,
        "weightPercent": 1.97
      },
      {
        "holdingClass": "上市通信網路",
        "amount": 12223,
        "weightPercent": 1.82
      },
      {
        "holdingClass": "上櫃通信網路",
        "amount": 11686,
        "weightPercent": 1.74
      },
      {
        "holdingClass": "上市電機機械",
        "amount": 10477,
        "weightPercent": 1.56
      },
      {
        "holdingClass": "上市其他電子",
        "amount": 7858,
        "weightPercent": 1.17
      },
      {
        "holdingClass": "上市電腦及週邊設備",
        "amount": 6716,
        "weightPercent": 1
      }
    ]
  }
}
