{
  "schemaVersion": "1.0",
  "fundId": "ACNB01",
  "fundName": "路博邁台灣5G股票基金T累積型",
  "capturedAt": "2026-09-18T12:36:23.354Z",
  "source": {
    "name": "moneydj-public",
    "navUrl": "https://www.moneydj.com/funddj/ya/yp010000.djhtm?a=ACNB01",
    "holdingsUrl": "https://www.moneydj.com/funddj/yp/yp013000.djhtm?a=ACNB01",
    "basicUrl": "https://www.moneydj.com/funddj/yp/yp011000.djhtm?a=ACNB01"
  },
  "nav": {
    "date": "2026-09-18",
    "value": 96.39,
    "changeAmount": 5.18
  },
  "fundProfile": {
    "managerNames": [
      "黃煜"
    ]
  },
  "holdingsDisclosure": {
    "date": "2026-08-31",
    "holdings": [
      {
        "name": "台積電",
        "shares": 1020,
        "weightPercent": 7.78,
        "monthlyChangePercent": -2.03
      },
      {
        "name": "致茂",
        "shares": 611,
        "weightPercent": 3.8,
        "monthlyChangePercent": -1.29
      },
      {
        "name": "健策",
        "shares": 341,
        "weightPercent": 6.47,
        "monthlyChangePercent": 2.4
      },
      {
        "name": "南電",
        "shares": 971,
        "weightPercent": 3.79,
        "monthlyChangePercent": 0
      },
      {
        "name": "創意",
        "shares": 314,
        "weightPercent": 6.08,
        "monthlyChangePercent": 1.77
      },
      {
        "name": "台達電",
        "shares": 607,
        "weightPercent": 3.54,
        "monthlyChangePercent": -0.99
      },
      {
        "name": "大立光",
        "shares": 206,
        "weightPercent": 5,
        "monthlyChangePercent": 0
      },
      {
        "name": "力旺",
        "shares": 445,
        "weightPercent": 3.39,
        "monthlyChangePercent": -0.61
      },
      {
        "name": "川湖",
        "shares": 100,
        "weightPercent": 4.51,
        "monthlyChangePercent": 0
      },
      {
        "name": "富喬",
        "shares": 7851,
        "weightPercent": 3.15,
        "monthlyChangePercent": 0
      }
    ],
    "industryWeights": [
      {
        "industry": "半導體業",
        "amount": 1253524,
        "weightPercent": 39.76
      },
      {
        "industry": "電子零組件業",
        "amount": 1172499,
        "weightPercent": 37.19
      },
      {
        "industry": "光電業",
        "amount": 225420,
        "weightPercent": 7.15
      },
      {
        "industry": "其他電子業",
        "amount": 163626,
        "weightPercent": 5.19
      },
      {
        "industry": "通信網路業",
        "amount": 144080,
        "weightPercent": 4.57
      },
      {
        "industry": "電機機械",
        "amount": 119173,
        "weightPercent": 3.78
      },
      {
        "industry": "電腦及週邊設備業",
        "amount": 74404,
        "weightPercent": 2.36
      }
    ],
    "holdingClassWeights": [
      {
        "holdingClass": "上市電子零組件",
        "amount": 773364,
        "weightPercent": 24.53
      },
      {
        "holdingClass": "上市半導體",
        "amount": 681304,
        "weightPercent": 21.61
      },
      {
        "holdingClass": "上櫃半導體",
        "amount": 621717,
        "weightPercent": 19.72
      },
      {
        "holdingClass": "上市其他電子",
        "amount": 195784,
        "weightPercent": 6.21
      },
      {
        "holdingClass": "上市光電",
        "amount": 157636,
        "weightPercent": 5
      },
      {
        "holdingClass": "上市電機機械",
        "amount": 152277,
        "weightPercent": 4.83
      },
      {
        "holdingClass": "上市通信網路",
        "amount": 122641,
        "weightPercent": 3.89
      },
      {
        "holdingClass": "存款",
        "amount": 147863,
        "weightPercent": 4.69
      },
      {
        "holdingClass": "上櫃電子零組件",
        "amount": 91114,
        "weightPercent": 2.89
      },
      {
        "holdingClass": "上市電腦及週邊設備",
        "amount": 68414,
        "weightPercent": 2.17
      },
      {
        "holdingClass": "上櫃通信網路",
        "amount": 121065,
        "weightPercent": 3.84
      }
    ]
  }
}
