{
  "schemaVersion": "1.0",
  "fundId": "ACPS10",
  "fundName": "統一奔騰基金",
  "capturedAt": "2026-09-03T12:35:17.098Z",
  "source": {
    "name": "moneydj-public",
    "navUrl": "https://www.moneydj.com/funddj/ya/yp010000.djhtm?a=ACPS10",
    "holdingsUrl": "https://www.moneydj.com/funddj/yp/yp013000.djhtm?a=ACPS10",
    "basicUrl": "https://www.moneydj.com/funddj/yp/yp011000.djhtm?a=ACPS10"
  },
  "nav": {
    "date": "2026-09-03",
    "value": 738.54,
    "changeAmount": -19.88
  },
  "fundProfile": {
    "managerNames": [
      "陳釧瑤"
    ]
  },
  "holdingsDisclosure": {
    "date": "2026-07-31",
    "holdings": [
      {
        "name": "台光電",
        "shares": 1272,
        "weightPercent": 9.65,
        "monthlyChangePercent": 0.4
      },
      {
        "name": "奇鋐",
        "shares": 1623,
        "weightPercent": 6.02,
        "monthlyChangePercent": 0.47
      },
      {
        "name": "台積電",
        "shares": 2408,
        "weightPercent": 9.34,
        "monthlyChangePercent": 1.53
      },
      {
        "name": "智邦",
        "shares": 1763,
        "weightPercent": 5.99,
        "monthlyChangePercent": 0.05
      },
      {
        "name": "旺矽",
        "shares": 851,
        "weightPercent": 7.19,
        "monthlyChangePercent": 0.2
      },
      {
        "name": "健策",
        "shares": 978,
        "weightPercent": 5.39,
        "monthlyChangePercent": 0.86
      },
      {
        "name": "欣興",
        "shares": 5577,
        "weightPercent": 7.02,
        "monthlyChangePercent": -0.58
      },
      {
        "name": "貿聯-KY",
        "shares": 1522,
        "weightPercent": 5.11,
        "monthlyChangePercent": 1.18
      },
      {
        "name": "聯發科",
        "shares": 1185,
        "weightPercent": 6.74,
        "monthlyChangePercent": 0.59
      },
      {
        "name": "國巨*",
        "shares": 5991,
        "weightPercent": 4.81,
        "monthlyChangePercent": -4.31
      }
    ],
    "industryWeights": [
      {
        "industry": "上市電子零組件業",
        "amount": 2325426,
        "weightPercent": 37.19
      },
      {
        "industry": "上市半導體業",
        "amount": 1444403,
        "weightPercent": 23.1
      },
      {
        "industry": "上市電腦及週邊設備業",
        "amount": 758468,
        "weightPercent": 12.13
      },
      {
        "industry": "上櫃半導體業",
        "amount": 502727,
        "weightPercent": 8.04
      },
      {
        "industry": "上市通信網路業",
        "amount": 374544,
        "weightPercent": 5.99
      },
      {
        "industry": "上市其他電子業",
        "amount": 330775,
        "weightPercent": 5.29
      },
      {
        "industry": "上櫃電子零組件業",
        "amount": 141314,
        "weightPercent": 2.26
      }
    ],
    "holdingClassWeights": [
      {
        "holdingClass": "上市電子零組件",
        "amount": 2520514,
        "weightPercent": 40.31
      },
      {
        "holdingClass": "上市半導體",
        "amount": 1398757,
        "weightPercent": 22.37
      },
      {
        "holdingClass": "上市電腦及週邊設備",
        "amount": 839129,
        "weightPercent": 13.42
      },
      {
        "holdingClass": "上櫃半導體",
        "amount": 400181,
        "weightPercent": 6.4
      },
      {
        "holdingClass": "上市通信網路",
        "amount": 311391,
        "weightPercent": 4.98
      },
      {
        "holdingClass": "上市其他電子",
        "amount": 267621,
        "weightPercent": 4.28
      },
      {
        "holdingClass": "上櫃電子零組件",
        "amount": 183833,
        "weightPercent": 2.94
      },
      {
        "holdingClass": "存款",
        "amount": 75659,
        "weightPercent": 1.21
      },
      {
        "holdingClass": "上市電機機械",
        "amount": 128183,
        "weightPercent": 2.05
      },
      {
        "holdingClass": "附條件債券",
        "amount": 58151,
        "weightPercent": 0.93
      },
      {
        "holdingClass": "上櫃通信網路",
        "amount": 48772,
        "weightPercent": 0.78
      },
      {
        "holdingClass": "上市汽車",
        "amount": 7503,
        "weightPercent": 0.12
      }
    ]
  }
}
