{
  "schemaVersion": "1.0",
  "fundId": "ACFT01",
  "fundName": "富蘭克林華美第一富基金-A累積型",
  "capturedAt": "2026-09-23T12:05:51.223Z",
  "source": {
    "name": "moneydj-public",
    "navUrl": "https://www.moneydj.com/funddj/ya/yp010000.djhtm?a=ACFT01",
    "holdingsUrl": "https://www.moneydj.com/funddj/yp/yp013000.djhtm?a=ACFT01",
    "basicUrl": "https://www.moneydj.com/funddj/yp/yp011000.djhtm?a=ACFT01"
  },
  "nav": {
    "date": "2026-09-23",
    "value": 301.91,
    "changeAmount": 2.57
  },
  "fundProfile": {
    "managerNames": [
      "羅兆弘"
    ]
  },
  "holdingsDisclosure": {
    "date": "2026-08-31",
    "holdings": [
      {
        "name": "台光電",
        "shares": 110,
        "weightPercent": 8.33,
        "monthlyChangePercent": 0.08
      },
      {
        "name": "信驊",
        "shares": 23,
        "weightPercent": 5.1,
        "monthlyChangePercent": -0.43
      },
      {
        "name": "欣興",
        "shares": 439,
        "weightPercent": 6.07,
        "monthlyChangePercent": 0.34
      },
      {
        "name": "南電",
        "shares": 300,
        "weightPercent": 5.1,
        "monthlyChangePercent": 1.29
      },
      {
        "name": "南亞",
        "shares": 1797,
        "weightPercent": 6.03,
        "monthlyChangePercent": 1.8
      },
      {
        "name": "旺矽",
        "shares": 70,
        "weightPercent": 4.96,
        "monthlyChangePercent": -1.16
      },
      {
        "name": "台積電",
        "shares": 170,
        "weightPercent": 5.65,
        "monthlyChangePercent": -1.18
      },
      {
        "name": "穎崴",
        "shares": 55,
        "weightPercent": 4.77,
        "monthlyChangePercent": -0.53
      },
      {
        "name": "大立光",
        "shares": 50,
        "weightPercent": 5.28,
        "monthlyChangePercent": 0
      },
      {
        "name": "聯亞",
        "shares": 85,
        "weightPercent": 4.14,
        "monthlyChangePercent": 0
      }
    ],
    "industryWeights": [
      {
        "industry": "半導體",
        "amount": 215881,
        "weightPercent": 29.87
      },
      {
        "industry": "電子零組件",
        "amount": 191236,
        "weightPercent": 26.46
      },
      {
        "industry": "約當現金",
        "amount": 94389,
        "weightPercent": 13.06
      },
      {
        "industry": "通信網路",
        "amount": 52326,
        "weightPercent": 7.24
      },
      {
        "industry": "其他電子",
        "amount": 49363,
        "weightPercent": 6.83
      },
      {
        "industry": "光電",
        "amount": 49146,
        "weightPercent": 6.8
      },
      {
        "industry": "塑膠工業",
        "amount": 43581,
        "weightPercent": 6.03
      },
      {
        "industry": "電腦及週邊設備",
        "amount": 15394,
        "weightPercent": 2.13
      },
      {
        "industry": "電機機械",
        "amount": 6794,
        "weightPercent": 0.94
      },
      {
        "industry": "生技醫療",
        "amount": 4626,
        "weightPercent": 0.64
      }
    ],
    "holdingClassWeights": [
      {
        "holdingClass": "上市電子零組件",
        "amount": 215014,
        "weightPercent": 29.75
      },
      {
        "holdingClass": "上市半導體",
        "amount": 156400,
        "weightPercent": 21.64
      },
      {
        "holdingClass": "上櫃半導體",
        "amount": 113614,
        "weightPercent": 15.72
      },
      {
        "holdingClass": "附條件債券",
        "amount": 36354,
        "weightPercent": 5.03
      },
      {
        "holdingClass": "上市其他電子",
        "amount": 55506,
        "weightPercent": 7.68
      },
      {
        "holdingClass": "上市光電",
        "amount": 32306,
        "weightPercent": 4.47
      },
      {
        "holdingClass": "上市塑膠",
        "amount": 7155,
        "weightPercent": 0.99
      },
      {
        "holdingClass": "上櫃通信網路",
        "amount": 24573,
        "weightPercent": 3.4
      },
      {
        "holdingClass": "上市電腦及週邊設備",
        "amount": 24139,
        "weightPercent": 3.34
      },
      {
        "holdingClass": "上市通信網路",
        "amount": 24212,
        "weightPercent": 3.35
      },
      {
        "holdingClass": "存款",
        "amount": 22116,
        "weightPercent": 3.06
      },
      {
        "holdingClass": "上櫃光電",
        "amount": 14744,
        "weightPercent": 2.04
      },
      {
        "holdingClass": "上市生技醫療",
        "amount": 7806,
        "weightPercent": 1.08
      }
    ]
  }
}
