{
  "schemaVersion": "1.0",
  "fundId": "ACIC01",
  "fundName": "野村優質基金-累積型",
  "capturedAt": "2026-09-08T12:36:18.349Z",
  "source": {
    "name": "moneydj-public",
    "navUrl": "https://www.moneydj.com/funddj/ya/yp010000.djhtm?a=ACIC01",
    "holdingsUrl": "https://www.moneydj.com/funddj/yp/yp013000.djhtm?a=ACIC01",
    "basicUrl": "https://www.moneydj.com/funddj/yp/yp011000.djhtm?a=ACIC01"
  },
  "nav": {
    "date": "2026-09-08",
    "value": 495.62,
    "changeAmount": -7.44
  },
  "fundProfile": {
    "managerNames": [
      "陳茹婷"
    ]
  },
  "holdingsDisclosure": {
    "date": "2026-07-31",
    "holdings": [
      {
        "name": "川湖",
        "shares": 751,
        "weightPercent": 11.39,
        "monthlyChangePercent": 1.33
      },
      {
        "name": "欣興",
        "shares": 4404,
        "weightPercent": 6.7,
        "monthlyChangePercent": 0.79
      },
      {
        "name": "台積電",
        "shares": 2127,
        "weightPercent": 9.97,
        "monthlyChangePercent": 1.36
      },
      {
        "name": "聯發科",
        "shares": 934,
        "weightPercent": 6.42,
        "monthlyChangePercent": -0.63
      },
      {
        "name": "台光電",
        "shares": 1013,
        "weightPercent": 9.29,
        "monthlyChangePercent": -0.42
      },
      {
        "name": "台達電",
        "shares": 1949,
        "weightPercent": 6.18,
        "monthlyChangePercent": -0.59
      },
      {
        "name": "健策",
        "shares": 1269,
        "weightPercent": 8.45,
        "monthlyChangePercent": 1.22
      },
      {
        "name": "旺矽",
        "shares": 481,
        "weightPercent": 4.91,
        "monthlyChangePercent": -0.3
      },
      {
        "name": "鴻勁",
        "shares": 666,
        "weightPercent": 7.96,
        "monthlyChangePercent": 0.29
      },
      {
        "name": "穎崴",
        "shares": 382,
        "weightPercent": 4.29,
        "monthlyChangePercent": -1.2
      }
    ],
    "industryWeights": [
      {
        "industry": "電子零組件業",
        "amount": 2395264,
        "weightPercent": 46.3
      },
      {
        "industry": "半導體業",
        "amount": 1981395,
        "weightPercent": 38.3
      },
      {
        "industry": "通信網路業",
        "amount": 243148,
        "weightPercent": 4.7
      },
      {
        "industry": "流動資產",
        "amount": 175894,
        "weightPercent": 3.4
      },
      {
        "industry": "其它電子業",
        "amount": 139681,
        "weightPercent": 2.7
      },
      {
        "industry": "光電業",
        "amount": 98294,
        "weightPercent": 1.9
      },
      {
        "industry": "居家生活",
        "amount": 46560,
        "weightPercent": 0.9
      },
      {
        "industry": "運動休閒",
        "amount": 41387,
        "weightPercent": 0.8
      },
      {
        "industry": "其他",
        "amount": 25867,
        "weightPercent": 0.5
      },
      {
        "industry": "鋼鐵工業",
        "amount": 25867,
        "weightPercent": 0.5
      }
    ],
    "holdingClassWeights": [
      {
        "holdingClass": "上市電子零組件",
        "amount": 2666865,
        "weightPercent": 51.55
      },
      {
        "holdingClass": "上市半導體",
        "amount": 1242640,
        "weightPercent": 24.02
      },
      {
        "holdingClass": "上櫃半導體",
        "amount": 357996,
        "weightPercent": 6.92
      },
      {
        "holdingClass": "上櫃通信網路",
        "amount": 258668,
        "weightPercent": 5
      },
      {
        "holdingClass": "存款",
        "amount": 163478,
        "weightPercent": 3.16
      },
      {
        "holdingClass": "上市其他電子",
        "amount": 110710,
        "weightPercent": 2.14
      },
      {
        "holdingClass": "上市光電",
        "amount": 131921,
        "weightPercent": 2.55
      },
      {
        "holdingClass": "上市通信網路",
        "amount": 51734,
        "weightPercent": 1
      },
      {
        "holdingClass": "上市居家生活",
        "amount": 34661,
        "weightPercent": 0.67
      },
      {
        "holdingClass": "上市運動休閒",
        "amount": 31557,
        "weightPercent": 0.61
      },
      {
        "holdingClass": "上市鋼鐵",
        "amount": 18107,
        "weightPercent": 0.35
      },
      {
        "holdingClass": "上市電腦及週邊設備",
        "amount": 100880,
        "weightPercent": 1.95
      },
      {
        "holdingClass": "上市觀光",
        "amount": 4139,
        "weightPercent": 0.08
      }
    ]
  }
}
