{
  "schemaVersion": "1.0",
  "fundId": "ACTT06",
  "fundName": "台新主流基金",
  "capturedAt": "2026-08-12T09:35:17.646Z",
  "source": {
    "name": "moneydj-public",
    "navUrl": "https://www.moneydj.com/funddj/ya/yp010000.djhtm?a=ACTT06",
    "holdingsUrl": "https://www.moneydj.com/funddj/yp/yp013000.djhtm?a=ACTT06",
    "basicUrl": "https://www.moneydj.com/funddj/yp/yp011000.djhtm?a=ACTT06"
  },
  "nav": {
    "date": "2026-08-11",
    "value": 176.45,
    "changeAmount": 3.3
  },
  "fundProfile": {
    "managerNames": [
      "黃千雲"
    ]
  },
  "holdingsDisclosure": {
    "date": "2026-06-30",
    "holdings": [
      {
        "name": "台光電",
        "shares": 54,
        "weightPercent": 8.32,
        "monthlyChangePercent": 1.04
      },
      {
        "name": "萬潤",
        "shares": 100,
        "weightPercent": 2.85,
        "monthlyChangePercent": -1.66
      },
      {
        "name": "欣興",
        "shares": 262,
        "weightPercent": 8.01,
        "monthlyChangePercent": 1.29
      },
      {
        "name": "臻鼎-KY",
        "shares": 154,
        "weightPercent": 2.77,
        "monthlyChangePercent": 0
      },
      {
        "name": "台燿",
        "shares": 164,
        "weightPercent": 7.88,
        "monthlyChangePercent": 0.58
      },
      {
        "name": "力成",
        "shares": 280,
        "weightPercent": 2.7,
        "monthlyChangePercent": 0
      },
      {
        "name": "台積電",
        "shares": 102,
        "weightPercent": 7.03,
        "monthlyChangePercent": 0.71
      },
      {
        "name": "同欣電",
        "shares": 340,
        "weightPercent": 2.6,
        "monthlyChangePercent": 0
      },
      {
        "name": "旺矽",
        "shares": 37,
        "weightPercent": 6.44,
        "monthlyChangePercent": 0.63
      },
      {
        "name": "群聯",
        "shares": 36,
        "weightPercent": 2.46,
        "monthlyChangePercent": 0
      },
      {
        "name": "雍智科技",
        "shares": 88,
        "weightPercent": 4.34,
        "monthlyChangePercent": 0
      },
      {
        "name": "健策",
        "shares": 24,
        "weightPercent": 2.35,
        "monthlyChangePercent": 0
      },
      {
        "name": "金居",
        "shares": 250,
        "weightPercent": 4.29,
        "monthlyChangePercent": 0.29
      },
      {
        "name": "聯發科",
        "shares": 19,
        "weightPercent": 2.31,
        "monthlyChangePercent": 0
      },
      {
        "name": "創意",
        "shares": 28,
        "weightPercent": 3.88,
        "monthlyChangePercent": 0
      },
      {
        "name": "穎崴",
        "shares": 10,
        "weightPercent": 2.31,
        "monthlyChangePercent": 0
      },
      {
        "name": "國巨*",
        "shares": 115,
        "weightPercent": 3.75,
        "monthlyChangePercent": 0
      },
      {
        "name": "玉晶光",
        "shares": 120,
        "weightPercent": 2.26,
        "monthlyChangePercent": 0
      },
      {
        "name": "南亞科",
        "shares": 270,
        "weightPercent": 3.49,
        "monthlyChangePercent": 0
      },
      {
        "name": "信邦",
        "shares": 230,
        "weightPercent": 2.16,
        "monthlyChangePercent": 0
      },
      {
        "name": "上詮",
        "shares": 201,
        "weightPercent": 3.33,
        "monthlyChangePercent": -0.9
      },
      {
        "name": "智邦",
        "shares": 29,
        "weightPercent": 2.07,
        "monthlyChangePercent": 0
      },
      {
        "name": "昇陽半導體",
        "shares": 340,
        "weightPercent": 3.08,
        "monthlyChangePercent": 0
      },
      {
        "name": "信驊",
        "shares": 4,
        "weightPercent": 1.89,
        "monthlyChangePercent": 0
      },
      {
        "name": "博智",
        "shares": 285,
        "weightPercent": 3.06,
        "monthlyChangePercent": 0
      }
    ],
    "industryWeights": [
      {
        "industry": "半導體業",
        "amount": 158701,
        "weightPercent": 45.39
      },
      {
        "industry": "電子零組件業",
        "amount": 148946,
        "weightPercent": 42.6
      },
      {
        "industry": "通信網路業",
        "amount": 18881,
        "weightPercent": 5.4
      },
      {
        "industry": "光電業",
        "amount": 7902,
        "weightPercent": 2.26
      }
    ],
    "holdingClassWeights": [
      {
        "holdingClass": "上市半導體",
        "amount": 110276,
        "weightPercent": 31.54
      },
      {
        "holdingClass": "上市電子零組件",
        "amount": 86361,
        "weightPercent": 24.7
      },
      {
        "holdingClass": "上櫃半導體",
        "amount": 41013,
        "weightPercent": 11.73
      },
      {
        "holdingClass": "上櫃電子零組件",
        "amount": 36293,
        "weightPercent": 10.38
      },
      {
        "holdingClass": "上市電腦及週邊設備",
        "amount": 36887,
        "weightPercent": 10.55
      },
      {
        "holdingClass": "上櫃通信網路",
        "amount": 19580,
        "weightPercent": 5.6
      },
      {
        "holdingClass": "存款",
        "amount": 10000,
        "weightPercent": 2.86
      },
      {
        "holdingClass": "上市通信網路",
        "amount": 7203,
        "weightPercent": 2.06
      }
    ]
  }
}
