{
  "schemaVersion": "1.0",
  "fundId": "ACYT11",
  "fundName": "元大新主流",
  "capturedAt": "2026-08-21T09:35:19.914Z",
  "source": {
    "name": "moneydj-public",
    "navUrl": "https://www.moneydj.com/funddj/ya/yp010000.djhtm?a=ACYT11",
    "holdingsUrl": "https://www.moneydj.com/funddj/yp/yp013000.djhtm?a=ACYT11",
    "basicUrl": "https://www.moneydj.com/funddj/yp/yp011000.djhtm?a=ACYT11"
  },
  "nav": {
    "date": "2026-08-21",
    "value": 185.12,
    "changeAmount": -4.76
  },
  "fundProfile": {
    "managerNames": [
      "葉信良"
    ]
  },
  "holdingsDisclosure": {
    "date": "2026-07-31",
    "holdings": [
      {
        "name": "台積電",
        "shares": 750,
        "weightPercent": 8.27,
        "monthlyChangePercent": 4.22
      },
      {
        "name": "環球晶",
        "shares": 1864,
        "weightPercent": 7.25,
        "monthlyChangePercent": 1.68
      },
      {
        "name": "聯電",
        "shares": 14265,
        "weightPercent": 7.85,
        "monthlyChangePercent": -0.35
      },
      {
        "name": "台光電",
        "shares": 294,
        "weightPercent": 6.34,
        "monthlyChangePercent": -1.66
      },
      {
        "name": "世界",
        "shares": 10784,
        "weightPercent": 7.43,
        "monthlyChangePercent": 0.39
      },
      {
        "name": "南電",
        "shares": 1099,
        "weightPercent": 4.6,
        "monthlyChangePercent": -0.29
      },
      {
        "name": "欣興",
        "shares": 2051,
        "weightPercent": 7.34,
        "monthlyChangePercent": -1.29
      },
      {
        "name": "致茂",
        "shares": 480,
        "weightPercent": 4.58,
        "monthlyChangePercent": 0
      },
      {
        "name": "旺矽",
        "shares": 304,
        "weightPercent": 7.3,
        "monthlyChangePercent": 1.08
      },
      {
        "name": "中美晶",
        "shares": 5658,
        "weightPercent": 4.04,
        "monthlyChangePercent": 0.37
      }
    ],
    "industryWeights": [
      {
        "industry": "半導體業",
        "amount": 1138539,
        "weightPercent": 51.78
      },
      {
        "industry": "電子零組件業",
        "amount": 529911,
        "weightPercent": 24.1
      },
      {
        "industry": "現金",
        "amount": 218341,
        "weightPercent": 9.93
      },
      {
        "industry": "其他電子業",
        "amount": 100705,
        "weightPercent": 4.58
      },
      {
        "industry": "電腦及週邊設備業",
        "amount": 83335,
        "weightPercent": 3.79
      },
      {
        "industry": "電子通路業",
        "amount": 64865,
        "weightPercent": 2.95
      },
      {
        "industry": "通信網路業",
        "amount": 63106,
        "weightPercent": 2.87
      }
    ],
    "holdingClassWeights": [
      {
        "holdingClass": "上市電子零組件",
        "amount": 810917,
        "weightPercent": 36.88
      },
      {
        "holdingClass": "上櫃半導體",
        "amount": 397983,
        "weightPercent": 18.1
      },
      {
        "holdingClass": "上市半導體",
        "amount": 392926,
        "weightPercent": 17.87
      },
      {
        "holdingClass": "上市電腦及週邊設備",
        "amount": 262537,
        "weightPercent": 11.94
      },
      {
        "holdingClass": "上櫃電子零組件",
        "amount": 119615,
        "weightPercent": 5.44
      },
      {
        "holdingClass": "上櫃通信網路",
        "amount": 135006,
        "weightPercent": 6.14
      },
      {
        "holdingClass": "存款",
        "amount": 79377,
        "weightPercent": 3.61
      }
    ]
  }
}
