{
  "schemaVersion": "1.0",
  "fundId": "ACES10",
  "fundName": "施羅德台灣樂活中小基金-A",
  "capturedAt": "2026-08-21T08:35:33.182Z",
  "source": {
    "name": "moneydj-public",
    "navUrl": "https://www.moneydj.com/funddj/ya/yp010000.djhtm?a=ACES10",
    "holdingsUrl": "https://www.moneydj.com/funddj/yp/yp013000.djhtm?a=ACES10",
    "basicUrl": "https://www.moneydj.com/funddj/yp/yp011000.djhtm?a=ACES10"
  },
  "nav": {
    "date": "2026-08-20",
    "value": 196.17,
    "changeAmount": 1.76
  },
  "fundProfile": {
    "managerNames": [
      "柯鴻旼"
    ]
  },
  "holdingsDisclosure": {
    "date": "2026-07-31",
    "holdings": [
      {
        "name": "台光電",
        "shares": 67,
        "weightPercent": 7.95,
        "monthlyChangePercent": -0.03
      },
      {
        "name": "南電",
        "shares": 273,
        "weightPercent": 6.25,
        "monthlyChangePercent": 0
      },
      {
        "name": "信驊",
        "shares": 19,
        "weightPercent": 7.02,
        "monthlyChangePercent": 2.05
      },
      {
        "name": "健策",
        "shares": 72,
        "weightPercent": 6.15,
        "monthlyChangePercent": 0.72
      },
      {
        "name": "致茂",
        "shares": 130,
        "weightPercent": 6.81,
        "monthlyChangePercent": 1.01
      },
      {
        "name": "台燿",
        "shares": 217,
        "weightPercent": 6.01,
        "monthlyChangePercent": -0.06
      },
      {
        "name": "創意",
        "shares": 69,
        "weightPercent": 6.54,
        "monthlyChangePercent": 2.04
      },
      {
        "name": "金像電",
        "shares": 265,
        "weightPercent": 5.23,
        "monthlyChangePercent": -0.16
      },
      {
        "name": "藥華藥",
        "shares": 245,
        "weightPercent": 6.48,
        "monthlyChangePercent": 0
      },
      {
        "name": "奇鋐",
        "shares": 90,
        "weightPercent": 5.2,
        "monthlyChangePercent": -0.06
      }
    ],
    "industryWeights": [
      {
        "industry": "半導體業",
        "amount": 130349,
        "weightPercent": 38.3
      },
      {
        "industry": "電子零組件業",
        "amount": 104824,
        "weightPercent": 30.8
      },
      {
        "industry": "現金",
        "amount": 62622,
        "weightPercent": 18.4
      },
      {
        "industry": "其他電子業",
        "amount": 23483,
        "weightPercent": 6.9
      },
      {
        "industry": "電腦及週邊設備業",
        "amount": 18378,
        "weightPercent": 5.4
      },
      {
        "industry": "生技醫療業",
        "amount": 681,
        "weightPercent": 0.2
      }
    ],
    "holdingClassWeights": [
      {
        "holdingClass": "上市電子零組件",
        "amount": 122506,
        "weightPercent": 30.54
      },
      {
        "holdingClass": "上市半導體",
        "amount": 80547,
        "weightPercent": 20.08
      },
      {
        "holdingClass": "上櫃半導體",
        "amount": 58926,
        "weightPercent": 14.69
      },
      {
        "holdingClass": "上市其他電子",
        "amount": 32893,
        "weightPercent": 8.2
      },
      {
        "holdingClass": "存款",
        "amount": 30927,
        "weightPercent": 7.71
      },
      {
        "holdingClass": "上櫃電子零組件",
        "amount": 29162,
        "weightPercent": 7.27
      },
      {
        "holdingClass": "上市生技醫療",
        "amount": 29483,
        "weightPercent": 7.35
      },
      {
        "holdingClass": "上市電腦及週邊設備",
        "amount": 23787,
        "weightPercent": 5.93
      }
    ]
  }
}
