{
  "schemaVersion": "1.0",
  "fundId": "ACCY149",
  "fundName": "國泰台灣高股息基金-A不配息",
  "capturedAt": "2026-10-22T12:35:18.759Z",
  "source": {
    "name": "moneydj-public",
    "navUrl": "https://www.moneydj.com/funddj/ya/yp010000.djhtm?a=ACCY149",
    "holdingsUrl": "https://www.moneydj.com/funddj/yp/yp013000.djhtm?a=ACCY149",
    "basicUrl": "https://www.moneydj.com/funddj/yp/yp011000.djhtm?a=ACCY149"
  },
  "nav": {
    "date": "2026-10-22",
    "value": 82.23,
    "changeAmount": -2.6
  },
  "fundProfile": {
    "managerNames": [
      "梁恩溢"
    ]
  },
  "holdingsDisclosure": {
    "date": "2026-09-30",
    "holdings": [
      {
        "name": "台積電",
        "shares": 1160,
        "weightPercent": 7.89,
        "monthlyChangePercent": -0.07
      },
      {
        "name": "致茂",
        "shares": 514,
        "weightPercent": 3.01,
        "monthlyChangePercent": 0
      },
      {
        "name": "聯發科",
        "shares": 487,
        "weightPercent": 6.57,
        "monthlyChangePercent": 1.12
      },
      {
        "name": "緯穎",
        "shares": 478,
        "weightPercent": 2.74,
        "monthlyChangePercent": -2.13
      },
      {
        "name": "欣興",
        "shares": 1779,
        "weightPercent": 5.73,
        "monthlyChangePercent": 1.16
      },
      {
        "name": "環球晶",
        "shares": 835,
        "weightPercent": 2.37,
        "monthlyChangePercent": 0
      },
      {
        "name": "川湖",
        "shares": 150,
        "weightPercent": 4.97,
        "monthlyChangePercent": -0.64
      },
      {
        "name": "萬潤",
        "shares": 629,
        "weightPercent": 2.26,
        "monthlyChangePercent": 0
      },
      {
        "name": "台光電",
        "shares": 357,
        "weightPercent": 4.83,
        "monthlyChangePercent": 0.78
      },
      {
        "name": "台塑化",
        "shares": 7985,
        "weightPercent": 2.13,
        "monthlyChangePercent": 0
      },
      {
        "name": "台達電",
        "shares": 922,
        "weightPercent": 4.78,
        "monthlyChangePercent": 0
      },
      {
        "name": "健鼎",
        "shares": 1466,
        "weightPercent": 2.11,
        "monthlyChangePercent": 0
      },
      {
        "name": "健策",
        "shares": 242,
        "weightPercent": 4.51,
        "monthlyChangePercent": 0.16
      },
      {
        "name": "文曄",
        "shares": 3390,
        "weightPercent": 1.91,
        "monthlyChangePercent": 0
      },
      {
        "name": "創意",
        "shares": 181,
        "weightPercent": 4,
        "monthlyChangePercent": 0
      },
      {
        "name": "富邦金",
        "shares": 3744,
        "weightPercent": 1.55,
        "monthlyChangePercent": 0
      },
      {
        "name": "旺矽",
        "shares": 283,
        "weightPercent": 3.97,
        "monthlyChangePercent": -0.16
      },
      {
        "name": "金像電",
        "shares": 381,
        "weightPercent": 1.17,
        "monthlyChangePercent": 0
      },
      {
        "name": "奇鋐",
        "shares": 420,
        "weightPercent": 3.96,
        "monthlyChangePercent": 0.35
      },
      {
        "name": "力旺",
        "shares": 129,
        "weightPercent": 1.17,
        "monthlyChangePercent": 0
      },
      {
        "name": "南亞",
        "shares": 5539,
        "weightPercent": 3.88,
        "monthlyChangePercent": 0
      },
      {
        "name": "大立光",
        "shares": 67,
        "weightPercent": 1.09,
        "monthlyChangePercent": -2.84
      },
      {
        "name": "信驊",
        "shares": 62,
        "weightPercent": 3.21,
        "monthlyChangePercent": 0
      },
      {
        "name": "京元電子",
        "shares": 1325,
        "weightPercent": 1.07,
        "monthlyChangePercent": 0
      },
      {
        "name": "貿聯-KY",
        "shares": 424,
        "weightPercent": 3.02,
        "monthlyChangePercent": 0
      },
      {
        "name": "日月光投控",
        "shares": 550,
        "weightPercent": 1.06,
        "monthlyChangePercent": 0
      }
    ],
    "industryWeights": [
      {
        "industry": "半導體業",
        "amount": 1268234,
        "weightPercent": 34.77
      },
      {
        "industry": "電子零組件",
        "amount": 1093519,
        "weightPercent": 29.98
      },
      {
        "industry": "電腦及週邊",
        "amount": 283410,
        "weightPercent": 7.77
      },
      {
        "industry": "其他電子業",
        "amount": 251677,
        "weightPercent": 6.9
      },
      {
        "industry": "其他合計",
        "amount": 145535,
        "weightPercent": 3.99
      },
      {
        "industry": "塑膠工業",
        "amount": 141523,
        "weightPercent": 3.88
      },
      {
        "industry": "電子通路業",
        "amount": 104683,
        "weightPercent": 2.87
      },
      {
        "industry": "金融保險",
        "amount": 90093,
        "weightPercent": 2.47
      },
      {
        "industry": "油電燃氣業",
        "amount": 77692,
        "weightPercent": 2.13
      },
      {
        "industry": "電機機械",
        "amount": 52159,
        "weightPercent": 1.43
      }
    ],
    "holdingClassWeights": [
      {
        "holdingClass": "上市電子零組件",
        "amount": 996496,
        "weightPercent": 27.32
      },
      {
        "holdingClass": "上市半導體",
        "amount": 833088,
        "weightPercent": 22.84
      },
      {
        "holdingClass": "上櫃半導體",
        "amount": 392106,
        "weightPercent": 10.75
      },
      {
        "holdingClass": "上市電腦及週邊設備",
        "amount": 214108,
        "weightPercent": 5.87
      },
      {
        "holdingClass": "上市其他電子",
        "amount": 204625,
        "weightPercent": 5.61
      },
      {
        "holdingClass": "上市塑膠",
        "amount": 171432,
        "weightPercent": 4.7
      },
      {
        "holdingClass": "上市電子通路",
        "amount": 108331,
        "weightPercent": 2.97
      },
      {
        "holdingClass": "存款",
        "amount": 153924,
        "weightPercent": 4.22
      },
      {
        "holdingClass": "上市金融保險",
        "amount": 118908,
        "weightPercent": 3.26
      },
      {
        "holdingClass": "上市油電燃氣",
        "amount": 98847,
        "weightPercent": 2.71
      },
      {
        "holdingClass": "上市光電",
        "amount": 137875,
        "weightPercent": 3.78
      },
      {
        "holdingClass": "上市電機機械",
        "amount": 55077,
        "weightPercent": 1.51
      },
      {
        "holdingClass": "上市航運業",
        "amount": 79880,
        "weightPercent": 2.19
      },
      {
        "holdingClass": "上櫃通信網路",
        "amount": 27721,
        "weightPercent": 0.76
      },
      {
        "holdingClass": "上櫃電腦及週邊設備",
        "amount": 11307,
        "weightPercent": 0.31
      },
      {
        "holdingClass": "上市通信網路",
        "amount": 18237,
        "weightPercent": 0.5
      },
      {
        "holdingClass": "上櫃電子零組件",
        "amount": 12401,
        "weightPercent": 0.34
      },
      {
        "holdingClass": "上市其他",
        "amount": 11307,
        "weightPercent": 0.31
      },
      {
        "holdingClass": "上市化工",
        "amount": 8024,
        "weightPercent": 0.22
      },
      {
        "holdingClass": "上市運動休閒",
        "amount": 6201,
        "weightPercent": 0.17
      },
      {
        "holdingClass": "上市汽車",
        "amount": 6201,
        "weightPercent": 0.17
      },
      {
        "holdingClass": "上櫃其他",
        "amount": 3283,
        "weightPercent": 0.09
      },
      {
        "holdingClass": "上市紡織纖維",
        "amount": 2918,
        "weightPercent": 0.08
      },
      {
        "holdingClass": "上市食品",
        "amount": 1824,
        "weightPercent": 0.05
      }
    ]
  }
}
